{
    "name": "Scav Prototype creature",
    "credits": {
        "maintainers": [
            "TrueChaos #4309268",
            "FlooferLand (RO) #5674026 (@flooferland)"
        ],
        "artists": ["TrueChaos #4309268"],
        "additional": "Original design from Scav Prototype"
    },
    "region": { "country": "ro", "state": "Arad" },
    "coords": {
        "link": "https://wplace.live/?lat=46.17830923535645&lng=21.372275059277328&zoom=16.207932134442082",
        "top_left": [1584, 3137]
    },
    "image": {
        "tile": [1145, 727],
        "coords": [584, 137],
        "png": "scav_creature.png"
    }
}
